{
  "version": "1.0",
  "suite": "slide90-management-reporting-core",
  "description": "Twenty-four wholly fictional management-reporting cases. Names, figures, systems, and events are invented solely for public testing.",
  "cases": [
    {"id":"performance-fictional-retail","category":"performance-dashboard","prompt":"Fictional case. A sample retailer reports quarterly revenue of $42 million, up 6%; gross margin is 28%, down 1 point; 12 stores opened; on-time delivery reached 95%. Growth continued, but margin recovery is the next priority.","expected_layout":"performance-dashboard","expected_title_intent":"Growth continued, but margin recovery is the next priority","required_facts":["$42 million","up 6%","gross margin is 28%","down 1 point","12 stores opened","on-time delivery reached 95%"],"must_not_invent":["market rank","profit amount","budget attainment"]},
    {"id":"performance-fictional-learning","category":"performance-dashboard","prompt":"Fictional case. A learning portal logged 4,800 sessions, 620 monthly users, 68% course completion, an 89% satisfaction score, and 140 overdue assignments. Adoption is healthy, while completion discipline needs attention.","expected_layout":"performance-dashboard","expected_title_intent":"Adoption is healthy, while completion discipline needs attention","required_facts":["4,800 sessions","620 monthly users","68% course completion","89% satisfaction","140 overdue assignments"],"must_not_invent":["revenue impact","headcount reduction","industry benchmark"]},
    {"id":"performance-fictional-support","category":"performance-dashboard","prompt":"Fictional case. A support desk handled 7,200 tickets; first response improved from 5 hours to 3 hours; first-contact resolution rose from 70% to 79%; satisfaction stayed at 92%; 110 tickets remain overdue.","expected_layout":"performance-dashboard","expected_title_intent":"Support efficiency improved, but overdue tickets remain a risk","required_facts":["7,200 tickets","5 hours to 3 hours","70% to 79%","92%","110 tickets"],"must_not_invent":["staff reduction","cost saving","complaint decline"]},

    {"id":"evidence-fictional-program-lead","category":"evidence-matrix","prompt":"Fictional case. Assess a program lead against four requirements: planning is proven by six delivered initiatives; governance by an approved control handbook; collaboration by three cross-team launches; team development by mentoring two new leads.","expected_layout":"evidence-matrix","expected_title_intent":"All four leadership requirements have direct delivery evidence","required_facts":["six delivered initiatives","approved control handbook","three cross-team launches","mentoring two new leads"],"must_not_invent":["years of service","external awards","employee rating"]},
    {"id":"evidence-fictional-vendor","category":"evidence-matrix","prompt":"Fictional case. Recommend Vendor Z using direct evidence: four comparable deployments, support for standard sign-on and APIs, an independent security audit, weekday onsite coverage, and round-the-clock remote support.","expected_layout":"evidence-matrix","expected_title_intent":"Vendor Z has direct evidence across delivery, integration, security, and support","required_facts":["four comparable deployments","standard sign-on and APIs","independent security audit","weekday onsite coverage","round-the-clock remote support"],"must_not_invent":["lowest price","market share","customer score"]},
    {"id":"evidence-fictional-readiness","category":"evidence-matrix","prompt":"Fictional case. A data program is ready to start: five domain owners approved the scope; customer and product records are included; nine interfaces are inventoried; three internal and two external contributors are assigned.","expected_layout":"evidence-matrix","expected_title_intent":"The data program meets all four start conditions","required_facts":["five domain owners","customer and product records","nine interfaces","three internal","two external"],"must_not_invent":["program budget","launch date","quality improvement"]},

    {"id":"diagnosis-fictional-delivery","category":"diagnosis-tree","prompt":"Fictional case. Average delivery time increased from 3 weeks to 6 weeks. Access approval consumes 9 days, teams rebuild the same connector, and five specialists carry 20 active requests. Leaders must simplify access, standardize integration, and cap work in progress.","expected_layout":"diagnosis-tree","expected_title_intent":"Approval delay, repeated integration, and excess work in progress doubled delivery time","required_facts":["3 weeks to 6 weeks","9 days","same connector","five specialists","20 active requests"],"must_not_invent":["skill shortage","vendor delay","budget cut"]},
    {"id":"diagnosis-fictional-forecast","category":"diagnosis-tree","prompt":"Fictional case. Forecast accuracy fell from 84% to 71%. One quarter of promotion plans arrived late, key accounts used offline sheets, and the model was not refreshed for two cycles. Fix data entry, unify the forecast channel, and restore scheduled refreshes.","expected_layout":"diagnosis-tree","expected_title_intent":"Late inputs and missed refreshes reduced forecast accuracy","required_facts":["84% to 71%","One quarter","offline sheets","two cycles","scheduled refreshes"],"must_not_invent":["market decline","staff turnover","algorithm defect"]},
    {"id":"diagnosis-fictional-inventory","category":"diagnosis-tree","prompt":"Fictional case. Inventory days rose from 38 to 52. Slow-moving items caused half the increase, order-batch settings were not reviewed for 18 months, and sales and supply teams aligned forecasts only monthly.","expected_layout":"diagnosis-tree","expected_title_intent":"Slow items, stale parameters, and infrequent alignment increased inventory","required_facts":["38 to 52","half the increase","18 months","only monthly"],"must_not_invent":["supplier price","warehouse capacity","cancelled orders"]},

    {"id":"roadmap-fictional-adoption","category":"roadmap","prompt":"Fictional case. A July-to-December adoption plan starts with 20 pilot users in July, expands to 60 users from August to October, targets 65% weekly activity, validates four use cases in November, and makes a scale decision in December.","expected_layout":"roadmap","expected_title_intent":"A staged pilot will support a December scale decision","required_facts":["20 pilot users","60 users","65% weekly activity","four use cases","December"],"must_not_invent":["company-wide rollout","purchase price","hours saved"]},
    {"id":"roadmap-fictional-data-hub","category":"roadmap","prompt":"Fictional case. A six-month data-hub plan catalogs 25 core tables in Q3, launches one access request in October, connects sales and logistics data in November, and uses a December security review as the gate for wider access.","expected_layout":"roadmap","expected_title_intent":"Build catalog and access controls before wider data access","required_facts":["25 core tables","Q3","October","sales and logistics","December security review"],"must_not_invent":["all enterprise data","real-time feeds","program budget"]},
    {"id":"roadmap-fictional-launch","category":"roadmap","prompt":"Fictional case. A product plan completes user validation in August, freezes scope in September, runs a small pilot in October, holds a quality review in November, and targets launch in December only if the review passes.","expected_layout":"roadmap","expected_title_intent":"The November quality review is the launch gate","required_facts":["August","September","October","November","December"],"must_not_invent":["sales target","development budget","launch market"]},

    {"id":"capability-fictional-service-loop","category":"capability-loop","prompt":"Fictional case. Build a service-production loop with business champions, knowledge stewards, data curators, solution designers, delivery engineers, and service evaluators. Show handoffs from demand and knowledge to design, delivery, measurement, and feedback.","expected_layout":"capability-loop","expected_title_intent":"Six roles connect demand, delivery, measurement, and feedback","required_facts":["business champions","knowledge stewards","data curators","solution designers","delivery engineers","service evaluators"],"must_not_invent":["new department","role headcount","outsourcing budget"]},
    {"id":"capability-fictional-demand-loop","category":"capability-loop","prompt":"Fictional case. A demand loop assigns request validation to key users, value assessment to business partners, solution design to product owners, delivery to engineering, adoption tracking to operations, and continue-adjust-stop decisions to a quarterly portfolio board.","expected_layout":"capability-loop","expected_title_intent":"Validation and quarterly portfolio decisions create a value loop","required_facts":["key users","business partners","product owners","engineering","operations","quarterly portfolio board"],"must_not_invent":["approval layers","team size","fixed lead time"]},
    {"id":"capability-fictional-knowledge-loop","category":"capability-loop","prompt":"Fictional case. A knowledge loop has experts approve content, stewards manage versions, a platform team control access, an application team package use cases, operators return low-rated answers, and a quarterly review retires obsolete content.","expected_layout":"capability-loop","expected_title_intent":"Clear ownership and feedback keep knowledge usable","required_facts":["experts approve content","stewards manage versions","platform team","application team","low-rated answers","quarterly review"],"must_not_invent":["repository size","accuracy target","vendor role"]},